{
  "wiremap": "/path/to/wiremap.json",
  "quantum-dot-config": "/path/to/quantum_dot_config.json",
  "inst-config": "/path/to/instrument_configs/",
  "teal-apis": "/path/to/teal_apis/",
  "lua-library-types": "/path/to/lua_libraries/",
  "user-measurement-luas": "/path/to/measurement_scripts/",
  "local-database": "/path/to/hdf5_database/",
  "nats-url": "nats://localhost:4222",
  "instrument-server-port": 8555
}
